{"device_id":"b44ac630c24d05dd173d23e848264539b9d218d74a6a8779a094d86878f6958e","device_pubkey":"ssh-ed25519 AAAATESTDEVICEKEY watchtower-device-001","first_seen_utc":"2026-03-01T00:00:00Z","hardware_fingerprint":"hwfp-test-001","manufacturer":"Lenovo","os_family":"windows","provisioning_policy_hash":"policyhash-test-001","schema":"watchtower.device.v1","serial":"SN-001","status":"enrolled","trust_level":"T1"}
