{"device_id":"936257f45d13ce95962d64d2c829b477253fded2caaa44a93cd9e92bd286d5a4","device_pubkey":"ssh-ed25519 AAAATESTDEVICEKEY binding-selftest","first_seen_utc":"2026-01-01T00:00:00Z","hardware_fingerprint":"hwfp-binding-001","manufacturer":"Lenovo","os_family":"windows","provisioning_policy_hash":"abc","schema":"watchtower.device.v1","serial":"SN-BIND-001","status":"enrolled","trust_level":"T1"}
