{"device_id":"6f6863b6f7fc80d71e1bd6461cf043e8e08b980833a43fadb40354a1e7cd7e21","device_pubkey":"ssh-ed25519 AAAATESTDEVICEKEY watchtower-device-chain-selftest","first_seen_utc":"2026-03-01T00:00:00Z","hardware_fingerprint":"hwfp-chain-selftest-001","manufacturer":"Lenovo","os_family":"windows","provisioning_policy_hash":"policyhash-chain-selftest-001","schema":"watchtower.device.v1","serial":"SN-CHAIN-001","status":"enrolled","trust_level":"T1"}
